{
  "version": 2,
  "run_id": "lane-4101-runtime",
  "lane_id": "lane-4101-runtime",
  "lane_plan_approval_sha256": "23c6b347d16e8ca2dc5f243a94231652b0e7b6573603c6fb1e7ea98cfb1803d5",
  "status": "ready",
  "created_by": "create-lane",
  "base_branch": "main",
  "source": {
    "type": "search-issue",
    "search_run_id": "search-native-release",
    "search_ledger": ".omo/search-issue/artifacts/search-native-release.json",
    "artifact_id": "search:search-native-release",
    "sha256": "b0169f5a9482fe7700f607c1676277af40591509a4c630e074c0be11d8e8a1a5"
  },
  "merge_policy": "supervisor-with-human-escalation",
  "pr_merge_method": "squash",
  "authority_scope": {
    "issue_creation": false,
    "pr_creation": true,
    "pr_merge": true,
    "cleanup_command_worktrees": true,
    "root_main_sync_ff_only": true,
    "publish_via_github_actions": false
  },
  "retry_policy": {
    "retry_count_is_terminal": true,
    "max_same_failure_repeats": 3,
    "max_wall_clock_minutes": 180,
    "stop_on_child_contract_error": true
  },
  "execution": {
    "status": "not-started",
    "last_command": null,
    "last_updated": null
  },
  "confirmed_issues": [4101],
  "suggested_but_excluded": [],
  "backlog_candidates": [],
  "release_handoffs": [4101],
  "completed_issues": [],
  "issue_progress": {},
  "lanes": [
    {
      "name": "release",
      "queue": [4101],
      "current_issue": 4101,
      "status": "queued",
      "branch": null,
      "worktree": null,
      "pr": null,
      "retry_count": 0
    }
  ],
  "dependency_graph": {},
  "root_main_sync": {
    "status": "not-started",
    "sha": null
  }
}
